{
  "$schema": "palette.schema.json",
  "$comment": "Ayu Dark. Source: https://github.com/ayu-theme/ayu-colors via primer/themes/ayu.palette.json (and its $comment). Licence: MIT. accent = ayu accent #e6b450 (yellow-gold), link = tag/indigo #39bae6, pink = markup coral #f07178; muted #8a9199 derived (ui.fg is 3:1 \u2192 disabled only); danger text #f26d78.",
  "id": "ayu",
  "name": "Ayu Dark",
  "docs": "https://github.com/ayu-theme/ayu-colors",
  "license": "MIT",
  "mode": "dark",
  "canvas": "#0d1017",
  "inset": "#0a0d13",
  "surface": "#10141c",
  "selection": "#1b1f29",
  "border": "#2a303c",
  "text": "#bfbdb6",
  "muted": "#8a9199",
  "disabled": "#5a6378",
  "accent": "#e6b450",
  "on_accent": "#0d1017",
  "link": "#39bae6",
  "success": "#aad94c",
  "warning": "#ff8f40",
  "danger": "#f26d78",
  "info": "#39bae6",
  "extra": {
    "red": "#d95757",
    "orange": "#ff8f40",
    "yellow": "#ffb454",
    "green": "#aad94c",
    "cyan": "#95e6cb",
    "purple": "#d2a6ff",
    "pink": "#f07178",
    "blue": "#39bae6"
  },
  "neutrals": [
    "#0a0d13",
    "#0d1017",
    "#10141c",
    "#141821",
    "#1b1f29",
    "#2a303c",
    "#3d4653",
    "#5a6378",
    "#8a9199",
    "#bfbdb6",
    "#ffffff"
  ],
  "roles": [
    "#e6b450",
    "#39bae6",
    "#ffb454",
    "#59c2ff",
    "#aad94c",
    "#95e6cb",
    "#f07178",
    "#ff8f40",
    "#e6c08a",
    "#d2a6ff",
    "#f29668",
    "#d95757"
  ]
}
