{
  "$schema": "palette.schema.json",
  "$comment": "Flexoki Dark. Source: https://stephango.com/flexoki. Licence: MIT. -400 steps. blue-400 cannot carry light or dark text, so accent_solid is the blue-600-class #1c507b with light text; danger text is red-300 #e8705f. The light block is Flexoki Light from https://stephango.com/flexoki (paper bg, base-50 bg-2, base-100/150 ui/ui-2, black tx, base-600 tx-2, base-300 tx-3, 600 accents), surface #ffffff derived (paper is the lightest upstream value) and success the green-700 #536907 because green-600 is 4.39:1 on paper.",
  "id": "flexoki",
  "name": "Flexoki",
  "docs": "https://stephango.com/flexoki",
  "license": "MIT",
  "mode": "dark",
  "canvas": "#100f0f",
  "inset": "#0a0909",
  "surface": "#1c1b1a",
  "selection": "#343331",
  "border": "#403e3c",
  "text": "#cecdc3",
  "muted": "#878580",
  "disabled": "#575653",
  "accent": "#4385be",
  "accent_solid": "#1c507b",
  "on_accent": "#cecdc3",
  "link": "#4385be",
  "success": "#879a39",
  "warning": "#da702c",
  "danger": "#e8705f",
  "info": "#4385be",
  "extra": {
    "red": "#d14d41",
    "orange": "#da702c",
    "yellow": "#d0a215",
    "green": "#879a39",
    "cyan": "#3aa99f",
    "purple": "#8b7ec8",
    "pink": "#ce5d97",
    "blue": "#4385be"
  },
  "neutrals": [
    "#0a0909",
    "#100f0f",
    "#1c1b1a",
    "#282726",
    "#343331",
    "#403e3c",
    "#575653",
    "#6f6e69",
    "#878580",
    "#9f9d96",
    "#b7b5ac",
    "#cecdc3",
    "#e6e4d9",
    "#fffcf0"
  ],
  "roles": [
    "#d14d41",
    "#da702c",
    "#d0a215",
    "#879a39",
    "#3aa99f",
    "#4385be",
    "#8b7ec8",
    "#ce5d97"
  ],
  "light": {
    "canvas": "#fffcf0",
    "inset": "#f2f0e5",
    "surface": "#ffffff",
    "selection": "#e6e4d9",
    "border": "#dad8ce",
    "text": "#100f0f",
    "muted": "#6f6e69",
    "disabled": "#b7b5ac",
    "accent": "#205ea6",
    "on_accent": "#fffcf0",
    "link": "#205ea6",
    "success": "#536907",
    "warning": "#bc5215",
    "danger": "#af3029",
    "info": "#205ea6",
    "extra": {
      "red": "#af3029",
      "orange": "#bc5215",
      "yellow": "#ad8301",
      "green": "#66800b",
      "cyan": "#24837b",
      "purple": "#5e409d",
      "pink": "#a02f6f",
      "blue": "#205ea6"
    },
    "neutrals": [
      "#b7b5ac",
      "#cecdc3",
      "#dad8ce",
      "#e6e4d9",
      "#f2f0e5",
      "#fffcf0"
    ]
  }
}
