{
  "$schema": "palette.schema.json",
  "$comment": "Nord. Source: https://www.nordtheme.com/docs/colors-and-palettes. Licence: MIT. Nord has no pink: nord15 purple stands in. danger is nord11 lifted to #d08a92 for text (nord11 is 3.6:1 on nord0); inset #272c36 is derived (nothing darker than nord0). Light block derived from the dark values (no upstream light variant): OKLCH, canvas hue kept, hues darkened in lightness for text on canvas (accent/link/info #3f7685, success #5e7647, warning #a15d47, danger from nord11 #ae525c).",
  "id": "nord",
  "name": "Nord",
  "docs": "https://www.nordtheme.com/docs/colors-and-palettes",
  "license": "MIT",
  "mode": "dark",
  "canvas": "#2e3440",
  "inset": "#272c36",
  "surface": "#3b4252",
  "selection": "#434c5e",
  "border": "#4c566a",
  "text": "#eceff4",
  "muted": "#d8dee9",
  "disabled": "#7b88a1",
  "accent": "#88c0d0",
  "on_accent": "#2e3440",
  "link": "#88c0d0",
  "success": "#a3be8c",
  "warning": "#d08770",
  "danger": "#d08a92",
  "info": "#88c0d0",
  "extra": {
    "red": "#bf616a",
    "orange": "#d08770",
    "yellow": "#ebcb8b",
    "green": "#a3be8c",
    "cyan": "#88c0d0",
    "purple": "#b48ead",
    "pink": "#b48ead",
    "blue": "#81a1c1"
  },
  "neutrals": [
    "#242933",
    "#272c36",
    "#2e3440",
    "#3b4252",
    "#434c5e",
    "#4c566a",
    "#d8dee9",
    "#e5e9f0",
    "#eceff4"
  ],
  "roles": [
    "#8fbcbb",
    "#88c0d0",
    "#81a1c1",
    "#5e81ac",
    "#bf616a",
    "#d08770",
    "#ebcb8b",
    "#a3be8c",
    "#b48ead"
  ],
  "light": {
    "canvas": "#f1f5fe",
    "inset": "#e7ebf3",
    "surface": "#fafcff",
    "selection": "#dfe3eb",
    "border": "#d5d9e1",
    "text": "#2e3440",
    "muted": "#636978",
    "disabled": "#9198a7",
    "accent": "#3f7685",
    "on_accent": "#ffffff",
    "link": "#3f7685",
    "success": "#5e7647",
    "warning": "#a15d47",
    "danger": "#ae525c",
    "info": "#3f7685",
    "extra": {
      "red": "#ae525c",
      "orange": "#a15d47",
      "yellow": "#a88a4c",
      "green": "#5e7647",
      "cyan": "#3f7685",
      "purple": "#876481",
      "pink": "#876481",
      "blue": "#53718f"
    },
    "neutrals": [
      "#2e3440",
      "#636978",
      "#d5d9e1",
      "#e7ebf3",
      "#f1f5fe",
      "#fafcff"
    ]
  }
}
