{
  "$schema": "palette.schema.json",
  "$comment": "Dracula. Source: https://draculatheme.com/spec. Licence: MIT. Values from assets/dracula.css (Dracula Classic; the light block is Alucard). Dracula spec is MIT.",
  "id": "dracula",
  "name": "Dracula",
  "docs": "https://draculatheme.com/spec",
  "license": "MIT",
  "mode": "dark",
  "canvas": "#282a36",
  "inset": "#21222c",
  "surface": "#343746",
  "selection": "#44475a",
  "border": "#44475a",
  "text": "#f8f8f2",
  "muted": "#a5b0d6",
  "disabled": "#6272a4",
  "accent": "#bd93f9",
  "on_accent": "#282a36",
  "link": "#8be9fd",
  "success": "#50fa7b",
  "warning": "#ffb86c",
  "danger": "#ff5555",
  "info": "#8be9fd",
  "extra": {
    "red": "#ff5555",
    "orange": "#ffb86c",
    "yellow": "#f1fa8c",
    "green": "#50fa7b",
    "cyan": "#8be9fd",
    "purple": "#bd93f9",
    "pink": "#ff79c6"
  },
  "neutrals": [
    "#191a21",
    "#21222c",
    "#282a36",
    "#343746",
    "#424450",
    "#44475a",
    "#6272a4",
    "#a5b0d6",
    "#f8f8f2"
  ],
  "roles": [
    "#8be9fd",
    "#50fa7b",
    "#ffb86c",
    "#ff79c6",
    "#bd93f9",
    "#ff5555",
    "#f1fa8c"
  ],
  "light": {
    "canvas": "#f8f8f2",
    "inset": "#efefea",
    "surface": "#ffffff",
    "selection": "#e9e9e3",
    "border": "#e9e9e3",
    "text": "#282a36",
    "muted": "#4f5b8a",
    "disabled": "#6272a4",
    "accent": "#7c4dff",
    "on_accent": "#ffffff",
    "link": "#7c4dff",
    "success": "#1a8f1a",
    "warning": "#c47f17",
    "danger": "#e30000",
    "info": "#0189c1",
    "extra": {
      "red": "#e30000",
      "orange": "#c47f17",
      "yellow": "#b89500",
      "green": "#1a8f1a",
      "cyan": "#0189c1",
      "purple": "#7c4dff",
      "pink": "#dc3eb7"
    },
    "neutrals": [
      "#e9e9e3",
      "#efefea",
      "#f8f8f2",
      "#ffffff"
    ]
  }
}
