{
  "$schema": "palette.schema.json",
  "$comment": "Selenized Dark. Source: https://github.com/jan-warchol/selenized via primer/themes/selenized.palette.json (and its $comment). Licence: MIT. accent blue is 3.9:1 and carries no text, so link is lightened #71abf0 and accent_solid is #0253a5 with fg_1 text; danger text #f28174; inset derived. purple = violet, pink = magenta.",
  "id": "selenized",
  "name": "Selenized Dark",
  "docs": "https://github.com/jan-warchol/selenized",
  "license": "MIT",
  "mode": "dark",
  "canvas": "#103c48",
  "inset": "#07262e",
  "surface": "#184956",
  "selection": "#2d5b69",
  "border": "#3a6a78",
  "text": "#cad8d9",
  "muted": "#adbcbc",
  "disabled": "#72898f",
  "accent": "#4695f7",
  "accent_solid": "#0253a5",
  "on_accent": "#cad8d9",
  "link": "#71abf0",
  "success": "#75b938",
  "warning": "#ed8649",
  "danger": "#f28174",
  "info": "#71abf0",
  "extra": {
    "red": "#fa5750",
    "orange": "#ed8649",
    "yellow": "#dbb32d",
    "green": "#75b938",
    "cyan": "#41c7b9",
    "purple": "#af88eb",
    "pink": "#f275be",
    "blue": "#4695f7"
  },
  "neutrals": [
    "#07262e",
    "#103c48",
    "#184956",
    "#2d5b69",
    "#72898f",
    "#adbcbc",
    "#cad8d9"
  ],
  "roles": [
    "#4695f7",
    "#41c7b9",
    "#75b938",
    "#fa5750",
    "#dbb32d",
    "#ed8649",
    "#af88eb",
    "#f275be"
  ]
}
