{
  "$schema": "palette.schema.json",
  "$comment": "SynthWave '84. Source: https://github.com/robb0wen/synthwave-vscode. Licence: MIT. link = the theme's textLink #f97e72; danger text #fb6567; the neon glow is a CSS effect and is not part of the palette. Light block derived from the dark values (no upstream light variant): OKLCH, canvas hue kept, hues darkened in lightness for text on canvas (accent #b83c9a, link/info #bd4840, success #077f57, warning #b15502, danger #cb3740); no neon glow.",
  "id": "synthwave84",
  "name": "SynthWave '84",
  "docs": "https://github.com/robb0wen/synthwave-vscode",
  "license": "MIT",
  "mode": "dark",
  "canvas": "#262335",
  "inset": "#241b2f",
  "surface": "#2a2139",
  "selection": "#37294d",
  "border": "#4a3d6b",
  "text": "#ffffff",
  "muted": "#848bbd",
  "disabled": "#6b6f9c",
  "accent": "#ff7edb",
  "on_accent": "#262335",
  "link": "#f97e72",
  "success": "#72f1b8",
  "warning": "#ff8b39",
  "danger": "#fb6567",
  "info": "#f97e72",
  "extra": {
    "red": "#fe4450",
    "orange": "#ff8b39",
    "yellow": "#fede5d",
    "green": "#72f1b8",
    "cyan": "#36f9f6",
    "purple": "#b893ce",
    "pink": "#ff7edb",
    "blue": "#2ee2fa"
  },
  "neutrals": [
    "#171520",
    "#241b2f",
    "#262335",
    "#2a2139",
    "#37294d",
    "#4a3d6b",
    "#6b6f9c",
    "#848bbd",
    "#b6b1b1",
    "#ffffff"
  ],
  "roles": [
    "#ff7edb",
    "#f97e72",
    "#ff8b39",
    "#fede5d",
    "#72f1b8",
    "#36f9f6",
    "#2ee2fa",
    "#b893ce",
    "#fe4450"
  ],
  "light": {
    "canvas": "#f5f4fd",
    "inset": "#ebeaf3",
    "surface": "#fcfbff",
    "selection": "#e3e2ea",
    "border": "#d9d8e1",
    "text": "#262335",
    "muted": "#6a677c",
    "disabled": "#9895ac",
    "accent": "#b83c9a",
    "on_accent": "#ffffff",
    "link": "#bd4840",
    "success": "#077f57",
    "warning": "#b15502",
    "danger": "#cb3740",
    "info": "#bd4840",
    "extra": {
      "red": "#db1634",
      "orange": "#b15502",
      "yellow": "#a78c06",
      "green": "#077f57",
      "cyan": "#027c7a",
      "purple": "#846198",
      "pink": "#b83c9a",
      "blue": "#017a88"
    },
    "neutrals": [
      "#262335",
      "#6a677c",
      "#d9d8e1",
      "#ebeaf3",
      "#f5f4fd",
      "#fcfbff"
    ]
  }
}
