{
  "$schema": "palette.schema.json",
  "$comment": "Catppuccin Mocha. Source: https://catppuccin.com/palette. Licence: MIT. orange = peach, cyan = sky, purple = mauve. The light block is Catppuccin Latte from https://github.com/catppuccin/palette/blob/main/palette.json (base canvas, mantle inset, surface0 selection/border, mauve accent with base text), surface #fafcff derived (Latte has nothing lighter than base), muted (subtext0) darkened to #696c82, link/info (blue) to #1b63f2, success (green) to #188000 and warning (peach) to #ce3400 for text.",
  "id": "catppuccin",
  "name": "Catppuccin",
  "docs": "https://catppuccin.com/palette",
  "license": "MIT",
  "mode": "dark",
  "canvas": "#1e1e2e",
  "inset": "#181825",
  "surface": "#313244",
  "selection": "#45475a",
  "border": "#45475a",
  "text": "#cdd6f4",
  "muted": "#a6adc8",
  "disabled": "#7f849c",
  "accent": "#cba6f7",
  "on_accent": "#1e1e2e",
  "link": "#89b4fa",
  "success": "#a6e3a1",
  "warning": "#fab387",
  "danger": "#f38ba8",
  "info": "#89b4fa",
  "extra": {
    "red": "#f38ba8",
    "orange": "#fab387",
    "yellow": "#f9e2af",
    "green": "#a6e3a1",
    "cyan": "#89dceb",
    "purple": "#cba6f7",
    "pink": "#f5c2e7",
    "blue": "#89b4fa",
    "teal": "#94e2d5"
  },
  "neutrals": [
    "#11111b",
    "#181825",
    "#1e1e2e",
    "#313244",
    "#45475a",
    "#585b70",
    "#6c7086",
    "#a6adc8",
    "#bac2de",
    "#cdd6f4"
  ],
  "roles": [
    "#b4befe",
    "#89b4fa",
    "#74c7ec",
    "#89dceb",
    "#94e2d5",
    "#a6e3a1",
    "#f9e2af",
    "#fab387",
    "#eba0ac",
    "#f38ba8",
    "#cba6f7",
    "#f5c2e7"
  ],
  "light": {
    "canvas": "#eff1f5",
    "inset": "#e6e9ef",
    "surface": "#fafcff",
    "selection": "#ccd0da",
    "border": "#ccd0da",
    "text": "#4c4f69",
    "muted": "#696c82",
    "disabled": "#8c8fa1",
    "accent": "#8839ef",
    "on_accent": "#eff1f5",
    "link": "#1b63f2",
    "success": "#188000",
    "warning": "#ce3400",
    "danger": "#d20f39",
    "info": "#1b63f2",
    "extra": {
      "red": "#d20f39",
      "orange": "#fe640b",
      "yellow": "#df8e1d",
      "green": "#40a02b",
      "cyan": "#04a5e5",
      "purple": "#8839ef",
      "pink": "#ea76cb",
      "blue": "#1e66f5",
      "teal": "#179299"
    },
    "neutrals": [
      "#acb0be",
      "#bcc0cc",
      "#ccd0da",
      "#dce0e8",
      "#e6e9ef",
      "#eff1f5"
    ]
  }
}
