{
  "$schema": "palette.schema.json",
  "$comment": "Night Owl. Source: https://github.com/sdras/night-owl-vscode-theme. Licence: MIT. pink = purple (no pink); muted #829ab0 derived (comment grey is 3.9:1); danger text #ff5874. The light block is Night Owl Light (https://github.com/sdras/night-owl-vscode-theme themes/Night Owl-Light-color-theme.json): canvas editor.background, inset sideBar.background, surface #ffffff, selection list.hoverBackground, border editorWidget.border, text foreground, disabled input.placeholderForeground, accent blue #4876d6 (strings), purple #994cc3, pink ansiMagenta #d6438a, cyan ansiCyan, teal #0c969b; no orange, so warning/orange = editorWarning #daaa01; muted darkened #5f7e97 to #597790, link/info/accent_solid darkened #4876d6 to #4370d0, success darkened ansiGreen to #00845e, warning darkened to #996b00, danger darkened ansiRed to #d73535 for text.",
  "id": "nightowl",
  "name": "Night Owl",
  "docs": "https://github.com/sdras/night-owl-vscode-theme",
  "license": "MIT",
  "mode": "dark",
  "canvas": "#011627",
  "inset": "#021320",
  "surface": "#0b253a",
  "selection": "#122d42",
  "border": "#234d70",
  "text": "#d6deeb",
  "muted": "#829ab0",
  "disabled": "#5f7e97",
  "accent": "#82aaff",
  "on_accent": "#011627",
  "link": "#82aaff",
  "success": "#addb67",
  "warning": "#f78c6c",
  "danger": "#ff5874",
  "info": "#82aaff",
  "extra": {
    "red": "#ef5350",
    "orange": "#f78c6c",
    "yellow": "#ecc48d",
    "green": "#addb67",
    "cyan": "#7fdbca",
    "purple": "#c792ea",
    "pink": "#c792ea",
    "blue": "#82aaff"
  },
  "neutrals": [
    "#021320",
    "#011627",
    "#0b253a",
    "#122d42",
    "#234d70",
    "#4b6479",
    "#5f7e97",
    "#829ab0",
    "#d6deeb"
  ],
  "roles": [
    "#82aaff",
    "#7fdbca",
    "#addb67",
    "#22da6e",
    "#ef5350",
    "#ff5874",
    "#f78c6c",
    "#ecc48d",
    "#c792ea"
  ],
  "light": {
    "canvas": "#fbfbfb",
    "inset": "#f0f0f0",
    "surface": "#ffffff",
    "selection": "#d3e8f8",
    "border": "#d9d9d9",
    "text": "#403f53",
    "muted": "#597790",
    "disabled": "#93a1a1",
    "accent": "#4876d6",
    "accent_solid": "#4370d0",
    "on_accent": "#ffffff",
    "link": "#4370d0",
    "success": "#00845e",
    "warning": "#996b00",
    "danger": "#d73535",
    "info": "#4370d0",
    "extra": {
      "red": "#de3d3b",
      "orange": "#daaa01",
      "yellow": "#e0af02",
      "green": "#08916a",
      "cyan": "#2aa298",
      "purple": "#994cc3",
      "pink": "#d6438a",
      "blue": "#4876d6",
      "teal": "#0c969b"
    },
    "neutrals": [
      "#d0d0d0",
      "#d9d9d9",
      "#e0e7ea",
      "#f0f0f0",
      "#f6f6f6",
      "#fbfbfb"
    ]
  }
}
