{
  "$schema": "palette.schema.json",
  "$comment": "Tokyo Night. Source: https://github.com/folke/tokyonight.nvim via primer/themes/tokyonight.palette.json (and its $comment). Licence: Apache-2.0. night variant. pink = magenta.",
  "id": "tokyonight",
  "name": "Tokyo Night",
  "docs": "https://github.com/folke/tokyonight.nvim",
  "license": "Apache-2.0",
  "mode": "dark",
  "canvas": "#1a1b26",
  "inset": "#16161e",
  "surface": "#232739",
  "selection": "#3b4261",
  "border": "#414868",
  "text": "#c0caf5",
  "muted": "#a9b1d6",
  "disabled": "#565f89",
  "accent": "#7aa2f7",
  "on_accent": "#1a1b26",
  "link": "#7aa2f7",
  "success": "#9ece6a",
  "warning": "#ff9e64",
  "danger": "#f7768e",
  "info": "#7aa2f7",
  "extra": {
    "red": "#f7768e",
    "orange": "#ff9e64",
    "yellow": "#e0af68",
    "green": "#9ece6a",
    "cyan": "#7dcfff",
    "purple": "#9d7cd8",
    "pink": "#bb9af7",
    "blue": "#7aa2f7",
    "teal": "#1abc9c"
  },
  "neutrals": [
    "#16161e",
    "#1a1b26",
    "#232739",
    "#292e42",
    "#3b4261",
    "#414868",
    "#545c7e",
    "#565f89",
    "#737aa2",
    "#a9b1d6",
    "#c0caf5"
  ],
  "roles": [
    "#7aa2f7",
    "#7dcfff",
    "#bb9af7",
    "#9d7cd8",
    "#ff9e64",
    "#e0af68",
    "#9ece6a",
    "#1abc9c",
    "#f7768e",
    "#db4b4b"
  ]
}
